sentiment,objectivity,emotion,variant,type,sentence
negative,org,plain,announce,NEWS,"four teenagers died earlier this year has been sold and is to close with the loss of 20 jobs, it was announced yesterday"
positive,org,plain,announce,NEWS,"Aid increase BRITISH medical aid to Croatia is to be extended, Armed Forces Minister Archie Hamilton announced last night"
negative,pers,plain,announce,NEWS,looked set to fall victim to the play's unlucky reputation. For when the company announced there would be no interval in the 2 7hour production and refused to change their minds
positive,pers,plain,announce,NEWS,"And soon afterwards, the friend phoned her. I've found your caravan, she announced. At the caravan site, a warden told Jean the number to look for"
neutral,org,plain,announce,NEWS,Adrian Hadley have all been selected in the Welsh squad announced today to face the old enemy on Friday
neutral,org,plain,announce,NEWS,Senior officials of the African National Congress have been urging Mr Mandela to announce an official separation from his wife since her latest outburst
neutral,org,plain,announce,NEWS,"the Wigan scrum-half, confirming yesterday he would be in contention for Great Britain's summer tour squad to be announced on Monday, the fringe contenders have their last chance to impress"
neutral,org,plain,announce,NEWS,"ensure compliance with the building specifications, the International Yacht Racing Union announced yesterday"
negative,org,plain,announce,NEWS,"Bairdwear announced the closure of its Newtown Aycliffe factory, with the loss of 95 jobs"
neutral,org,plain,announce,NEWS,"protested that the record 50p rise should have been announced in an oral statement to the House, giving members the chance to question it"
neutral,org,plain,announce,NEWS,"unveiled by Clarke THE most important reform of the police for 30 years was announced by the Home Secretary, Kenneth Clarke, yesterday"
neutral,pers,plain,announce,NEWS,"Then, suddenly, they changed their minds. They announced the sale of the lease to a brand new company called Inn Business Ltd"
neutral,org,plain,announce,NEWS,Last month it was announced that Britain will get its first new-wave trams in 1991
positive,org,plain,announce,NEWS,The IoD estimates that the increased taxes announced yesterday will have the effect of adding 7p to income tax
neutral,org,plain,announce,NEWS,"Yesterday, the EC announced that Kemira and the other British fertiliser manufacturers had won their case against the Russians"
neutral,org,plain,announce,NEWS,"The order, announced in the House of Commons by the junior defence minister"
neutral,pers,plain,announce,NEWS,Four months later Anne and Mark announced their separation
neutral,org,plain,announce,NEWS,Mrs Thatcher will today announce that she is to double the British contribution of million to the UN Environment Project
negative,org,plain,announce,NEWS,was an 11-year-old schoolboy when the King's death was announced at morning assembly. I went with a friend to see the headmaster and ask his permission
neutral,org,plain,announce,NEWS,Good Shepherd at Four Marks have announced far reaching plans to extend pastoral care further into the parish
positive,org,plain,announce,NEWS,News deal THE New York Times announced it is buying the Boston Globe for a record one billion dollars
neutral,org,plain,announce,NEWS,"apparently encouraged by the new international policy announced in Washington, not only invited Bosnian Muslim and Croat leaders to meet him to discuss a settlement"
neutral,org,plain,announce,NEWS,Jets order secures jobs BRITISH Aerospace today announced a 500m deal to sell Hawk jet trainers to Indonesia
neutral,pers,plain,announce,NEWS,Mr Lang hopes to announce the decision on the boundaries of the new authorities in the next four months
positive,org,plain,announce,NEWS,"despite one of the most difficult trading years in memory, the society has announced record results with: Asset growth up 11.49 per cent to 225m"
neutral,pers,plain,announce,NEWS,He and proud mum Christine will be waiting with bated breath as Will Carling announces the winners at a special ceremony in the Howard Hotel
neutral,org,plain,announce,NEWS,"new Socialist Party should pick up the pieces, as a marginal hardline faction announce d the foundation of the Hungarian Communist Party"
neutral,org,plain,announce,NEWS,"Mr Tony Blair, last weekend announced the Opposition's support for the full Social Charter agenda"
neutral,org,plain,announce,NEWS,the Romanian leader announced publicly that he would not accept a ban on chemical weapons unless a universal ban
neutral,org,plain,announce,NEWS,"Nor, despite the merit of the achievement, did the Ryder Cup team get the vote when the Golf Writers Association announce their selection for their annual trophy this year"
neutral,org,plain,announce,NEWS,"AH says it has been forced into a big cost-cutting exercise because of the effect of Petroleum Revenue Tax changes, announced in the last Budget"
neutral,org,plain,announce,NEWS,wiped out DISAPPOINTED charities were only grudgingly grateful for the estimated 30 million boost to their income announced by the Chancellor yesterday
negative,org,plain,announce,NEWS,The Chancellor decides on a rate rise to 12 per cent. 11.01am: Rise announced. Stock market instantly plunges
neutral,org,plain,announce,NEWS,"Industrial Correspondent BRITISH Aerospace yesterday announced the 35m launch of a new mid-sized, twin-engined business"
neutral,org,plain,announce,NEWS,That is the drift of policy announced yesterday
neutral,org,plain,announce,NEWS,health authority expect to receive from a national health department package announced two weeks ago
neutral,org,plain,announce,NEWS,As soon as Mr Lamont has announced that the cash is there for the Jubilee Line and other great projects
positive,org,plain,announce,NEWS,"City: Ashley into black LAURA Ashley, at 93p, will tomorrow announce a return to trading profit after its recent setbacks"
neutral,org,plain,announce,NEWS,Sky TV yesterday announced they have exclusive rights to show his championship challenge
neutral,org,plain,announce,NEWS,"When the working party was announced, it was claimed the membership had been loaded towards the landowning fraternity"
neutral,org,plain,announce,NEWS,"ML Laboratories, expected to announce new drug developments soon, jumped 40p to 495p"
neutral,org,plain,announce,NEWS,The results were announced as Labour predicted the wasted generation of jobless people under 25 would approach the one million
negative,org,plain,announce,NEWS,"Abolhassan Bani-Sadr, announced that 20 people had been killed in an explosion"
neutral,org,plain,announce,NEWS,"A fund-raising cake stall for the Over 60s was announced, to be held at the Petersfield Pop-In Club Coffee Room"
neutral,org,plain,announce,NEWS,A member of European Parliament who grew up in Teesdale has announced her engagement to a top businessman
neutral,org,plain,announce,NEWS,"Italy's 1.5bn dollar Eurobond is largest issue to date By JASON NISSE ITALY yesterday announced a $1.5bn issue of fixed-rate Eurobonds, the largest such deal to date"
neutral,org,plain,announce,NEWS,"wo consortia one led by P & O and the other by Trafalgar House are still bidding for partnership with BR, which is due to announce its choice by the end of the month"
neutral,org,plain,announce,NEWS,"Drugs wait for Russia RUSSIA'S athletics chief, Valentin Balakhnichov, has announced he will wait for dope test results, expected later this week"
neutral,org,plain,announce,NEWS,the Dragon board announced that it had received acceptances from 750 shareholders
neutral,pers,plain,announce,NEWS,Then she will announce in a suitable low-key way her appointees
neutral,org,plain,announce,NEWS,they announced a joint rescue package for financially-crippled Tottenham Hotspur
neutral,org,plain,announce,NEWS,tell her of the decision before it was announced in South Africa. Five of the eight prisoners due to be released were convicted of terrorism and sentenced for life
negative,org,plain,announce,NEWS,The club announced on Tuesday that they made a 1.4m trading loss
neutral,org,plain,announce,NEWS,"A second round of ministerial changes, in the middle and junior ranks, will be announced tomorrow. Traffic chaos expected for months"
neutral,org,plain,announce,NEWS,Similar settlement terms were announced by Miss Latimer's counsel
neutral,org,plain,announce,NEWS,"Graeme Wright, editor of Wisden since 1986, announced he was quitting at last night's launch of the 1992 edition"
neutral,org,plain,announce,NEWS,Middlesex are expected to announce his retirement from the game today
neutral,org,plain,announce,NEWS,The England squad is announced next week and he said: There's little chance of being involved with England if I can't get in my club side first
neutral,org,plain,announce,NEWS,"Meanwhile, ITV	announced yesterday that it will televise live Norwich's game with United on January 21"
neutral,pers,plain,announce,NEWS,"With the mannerisms of a Sesame Street presenter, Dr Henning announced himself as an expert in making things disappear and revealed that he would make the problems of the nation disappear"
neutral,org,plain,announce,NEWS,A 30m clean-up of the River Tees has been announced by the Northumbrian Water company
neutral,org,plain,announce,NEWS,"In May last year, Mr Gorbachev's cable arrived several minutes before Karoly Grosz's election to the leadership was announced. This time, the new name deserved no greetings"
neutral,org,plain,announce,NEWS,"The attack came from Labour leader John Smith as more than 17,000 jobs cuts were announced by the Post Office and the Royal Ordnance, while Ford unions claimed 3,000 workers are to go"
neutral,org,plain,announce,NEWS,MORE plans have been submitted for a new town centre shopping complex in Ipswich just days after a major retailer announced it was pulling out of the town
neutral,org,plain,announce,NEWS,"Yet when pedestrianisation was first announced the city's shopkeepers, taxi drivers and disabled groups kicked up a fuss"
neutral,org,plain,announce,NEWS,Plans for the creation of 20 CTCs by 1990 were announced by Kenneth Baker
positive,org,plain,announce,NEWS,"Liffe has taken the modest route of allowing access to APT through any authorised carrier, such as Telerate, with whom agreement was announced yesterday"
neutral,org,plain,announce,NEWS,"This palmtop-to-datacentre idea is echoed by Digital's recently announced Alpha design, intended as a replacement for its best-selling VAX and PDP minicomputer lines"
neutral,org,plain,announce,NEWS,"Virginia Bottomley announced an inquiry, saying: It is vital that the lessons of this dreadful case are learnt and acted upon without delay"
positive,org,plain,announce,NEWS,"In order to help achieve that aim, a new business operating structure has been announced which will streamline the operation of each Brunner Mond business"
neutral,org,plain,announce,NEWS,"The Volunteers, is to be disbanded, the colony's government announced yesterday. Its end, in September 1995, is necessary before China retakes sovereignty"
positive,org,plain,announce,NEWS,She too held her head high as they announced the fight and played the national anthems
neutral,org,plain,announce,NEWS,Mr Mugabe	announce	d yesterday that the national elections are expected to be held
neutral,org,plain,announce,NEWS,"ndia and Pakistan were hotly disputing ownership of the 1,500-mile Indus River in 1968 when he announced the UN-sponsored Indus Basin project to share water supplies for new power stations"
neutral,pers,plain,announce,NEWS,Ferrari's decision places Mansell in a dilemma. He announced on the eve of the Spanish Grand Prix that he would contemplate retirement
neutral,org,plain,announce,NEWS,"Scrum-half Peter Sterling, 32, one of Australia's finest players, announced his retirement yesterday after suffering a severe shoulder injury"
neutral,org,plain,announce,NEWS,"Also addressing the Dolphin Centre rally was Darlington-born Tom Sawyer, deputy secretary of NUPE, who won a roar from the crowd when he announced new opinion poll findings giving Labour"
neutral,org,plain,announce,NEWS,The winner will be announced in six weeks' time and both the winning plumber and the nominator will receive holidays
neutral,org,plain,announce,NEWS,"Michael Ancram, had by contrast taken consultation seriously and announced a slowing up of the reform process to get it right"
negative,org,plain,announce,NEWS,"Rolls-Royce announced last month 5,000 job losses over the next two years"
neutral,org,plain,announce,NEWS,Michael Howard has already announced that up to 1.4 million people have applied for water shares
neutral,org,plain,announce,NEWS,Yesterday it announced figures for the first half of 1989 so late in the day that the London market had mostly packed up
neutral,org,plain,announce,NEWS,"Slipping But they must progress without brilliant fly-half Naas Botha, who announced his retirement at the end of his 28th Test"
neutral,org,plain,announce,NEWS,On the porch a notice announces that the occupier takes part in the neighbourhood watch scheme
neutral,pers,plain,announce,NEWS,"Mrs Kinnock, 47, last month announced her intention to stand for the 1994 European Parliament elections"
neutral,org,plain,declare,NEWS,"On Monday, the White House declared the violence to be part of a pattern of harassment"
negative,org,plain,declare,NEWS,"The church distributed 16,000 copies of the letter which was immediately declared seditious, and the Congress Party secretly sentenced the bishops to death"
neutral,org,plain,declare,NEWS,"financial corruption and will not tolerate corruption or lax behaviour, he declared, drawing loud applause from the packed public galleries"
neutral,org,plain,declare,NEWS,declaration and appeared in the debate to declare their neutrality and respect for the constitution
positive,org,plain,declare,NEWS,Teheran IRAN'S leaders	declare	d yesterday's general election a success
neutral,org,plain,declare,NEWS,"five hours before India, 31 ahead on first innings, declared at 8. Mandy Yachad and Mark Rushmere made half centuries and when both sides agreed"
neutral,org,plain,declare,NEWS,"Peking would be free to declare Martial Law; and there, too, a garrison of the People's Liberation Army would stand ready to suppress opposition"
neutral,org,plain,declare,NEWS,"here are no negotiations at the moment, a county spokesman said, and before they are started the homes must be declared surplus to the councils requirements"
neutral,org,plain,declare,NEWS,"We need millions of owners, not hundreds of millionaires, he declared to rare applause"
neutral,pers,plain,declare,NEWS,"These Aussies are no angels, he	 declared. We had to fight fire with fire"
neutral,org,plain,declare,NEWS,"Peter Hall Escapes halved, declares Group 4 THE average number of escapes had halved"
neutral,org,plain,declare,NEWS,Downing Street declared the scheme was Premier John Major's Christmas present to the nation
positive,org,plain,declare,NEWS,The former Olympic sprinter declared: Our athletes have achieved success in spite of the system
positive,pers,plain,declare,NEWS,went back to Wimbledon yesterday and declared: I've taken the first step on the managerial ladder
negative,org,plain,declare,NEWS,"With more than 500 results declared, early hopes that the Mr Kinnock could enter Downing Street at the head of a minority Government had all but evaporated"
neutral,org,plain,declare,NEWS,"and the hidden agenda was to end the un declared war between predominantly white and Jewish teachers, and an increasingly black and Hispanic body of pupils"
negative,pers,plain,declare,NEWS,last Sunday then declared: Chapman is my headache. He's so good in the air
positive,pers,plain,declare,NEWS,"she declares, should start a new life for herself."
negative,org,plain,declare,NEWS,"Trying to scare Ukraine is impudent and fruitless, he declared. International: Premier calls for Norway to join EC"
neutral,org,plain,declare,NEWS,Lloyd George once declared that the British element in the ICS was the steel frame of the Indian constitutional structure
neutral,pers,plain,declare,NEWS,the Nottingham Forest star who declared England had no chance of winning the next World Cup
neutral,org,plain,declare,NEWS,The reversionary or annual bonuses paid on the bonuses already declared on with-profits endowments have been reduced from 7 to 5 per cent
neutral,pers,plain,declare,NEWS,"The boy from Horsham, Sussex, declares his ambition is to have a bath with politician Virginia Bottomley"
neutral,org,plain,declare,NEWS,"A total of four results have been declared so far. The USS Enterprise may have been able to go into hyperspace, but the ITN news"
neutral,org,plain,declare,NEWS,"chairman of the executive, declared final and definite decisions would be taken at the meeting on the proposals"
neutral,org,plain,declare,NEWS,The auditor is seeking to have the transactions declared unlawful because they were ultra vires beyond the council's legal powers
neutral,org,plain,declare,NEWS,the Lithuanian Communist Party has voted by more than 5-1 to declare itself an independent party. Page 8. Ethnic recruitment
neutral,pers,plain,declare,NEWS,Benson declared his availability for this year's Ireland matches and the Irish selectors deemed he should play for Munster
negative,org,plain,declare,NEWS,"become a viable business in niche markets, the company declared. In 1992/3, the crash of Leyland DAF hit Wiring Systems with a bad debt provision"
neutral,org,plain,declare,NEWS,retract their statement on proxy voting and to declare Monday's decision to merge with Bute null and void
neutral,org,plain,declare,NEWS,Mr Curry declared: 0.5 billion a year goes to hill farmers in public support
neutral,pers,plain,declare,NEWS,was cheered when he declared his belief that nuclear weapons did nothing for Britain's security
neutral,org,plain,declare,NEWS,"Next Friday he drives to London about 3am, immediately the Bishop Auckland result is declared. I was with Neil in the misery of a defeat that was far greater"
neutral,pers,plain,declare,NEWS," On reaching Port Said, however, the captain declared that Annesley would have to be more respectably attired if he wished to continue in first class"
negative,org,plain,declare,NEWS,"The town in North Bohemia, one of Europe's most environmentally devastated regions, declared an emergency last Friday after being engulfed in dense"
neutral,org,plain,declare,NEWS,"The gathering, declared Grachev responsible for dismantling the country's defences, allowing the break-up of the armed forces"
neutral,pers,plain,declare,NEWS,Eddie Murphy EDDIE Murphy has declared himself a servant of God. God sent all artists here
neutral,org,plain,declare,NEWS,"An interim dividend of 2.35p was declared, an increase of 9pc on last year's 2.15p"
neutral,pers,plain,declare,NEWS,"Ardiles, eager to bounce back after losing the Newcastle job to Kevin Keegan, declared an immediate interest in the Hawthorns' vacancy"
neutral,pers,plain,declare,NEWS,"At least the race was completed and did not have to be declared void, Arkwright added"
neutral,pers,plain,declare,NEWS,"It was a personal triumph for Gen Morillon, who went to Srebrenica last Thursday and declared he would not abandon the town's 60,000 desperate inhabitants until the convoy got through"
neutral,pers,plain,declare,NEWS,McCoist back for Euro clash by Scott McMunn ALLY McCOIST last night declared himself fit for tomorrow's European Cup match against CSKA Moscow and vowed to make up for lost time
neutral,pers,plain,declare,NEWS,Piggott fit again LESTER Piggott has declared himself fit to ride less than a month after his horrific fall in the Breeders' Cup
neutral,org,plain,declare,NEWS,A total of 500 council houses have been declared uninhabitable and it will cost 2m to deal with them
neutral,pers,plain,declare,NEWS,You do not need to declare certificates in your yearly tax return
neutral,org,plain,announce,OTHERSP,The closure has been confirmed twenty four hours after British Coal announced the pit was to go into the review procedure and revealed that it's lost more than six million
positive,pers,plain,announce,OTHERSP,"Erm we're pleased to announce that we've appointed a new handyman erm er Mr Dennis , who's accepted the appointment"
neutral,org,plain,announce,OTHERSP,"The Minister announced increased anti-pollution grants available to farmers, but wouldn't be drawn on their likely success"
neutral,org,plain,announce,OTHERSP,The Home Secretary Michael Howard has announced measures to cut down on the amount of police paperwork and put more officers
neutral,org,plain,announce,OTHERSP,It was just over a year ago that British Coal announced the closure of thirty one of Britain's deep mines
neutral,pers,plain,announce,OTHERSP,"It's just, they just announced this morning that he's, and he's asked to go"
neutral,pers,plain,announce,OTHERSP,B and Q erm recently announced that er not recently I mean in the last eighteen months
positive,pers,plain,announce,OTHERSP,"He sends a runner, Kaufman, to announce it. That's guts"
positive,pers,plain,announce,OTHERSP,It gives me great pleasure to announce that that would mean Cherwell District Council would have to disappear as well
neutral,org,plain,announce,OTHERSP,I'm only gonna a month ago they did actually er officially announce  the launch of a product there it's the pen writing pad personal organizer there
neutral,org,plain,announce,OTHERSP,We have announced a number of job losses over the past 12 months
neutral,org,plain,announce,OTHERSP,it was done before poll tax was erm it's only just been announced because there's been a lot of negotiations going on
negative,org,plain,announce,OTHERSP,Within the past hour has announced that a review is being launched into the future of three pits
neutral,pers,plain,announce,OTHERSP,"that the conditions attaching to that grant, would be announced separately"
neutral,org,plain,announce,OTHERSP,National Westminster has announced four thousand redundancies and yet you still have to wait ages in the queue at the bank
neutral,pers,plain,announce,OTHERSP,"The first thing you do is announce half way through a year that they're gonna put back some, but not all, of the money they cut from the budget"
neutral,pers,plain,announce,OTHERSP,"there was a lot to think about, tomorrow Mrs, Mr Davis her form teacher would announce the winner of the class essay contest"
neutral,pers,plain,announce,OTHERSP,car park between the hours of two and five whilst shopping. Could you please announce this on your show
neutral,pers,plain,announce,OTHERSP,"no doubt have seen in the press that the same time as we announced our results at the end of March that we agreed to buy, er, the Alton Towers theme park"
neutral,pers,plain,announce,OTHERSP,They also announced a thing called D R D A two
neutral,pers,plain,announce,OTHERSP,very important people they announce in the room we are from video such and such
neutral,org,plain,announce,OTHERSP,who operate Hatfield Aerodrome er announced that they will cease trading and the Airport will cease to be operational
neutral,pers,plain,announce,OTHERSP,The first thing you do is announce half way through a year that they're gonna put back some
neutral,pers,plain,announce,OTHERSP,There there you go announced the waitress setting two hot plates before them
positive,org,plain,announce,OTHERSP,"the Chancellor of the Exchequer announced on the thirtieth of November, is of course designed to encourage more young people to train up"
neutral,pers,plain,announce,OTHERSP,Are they gonna actually an announce it to erm the general public? Yes
neutral,org,plain,announce,OTHERSP,"Since then, both yards which are run by private firms under contract, have announced hundreds of redundancies"
neutral,org,plain,announce,OTHERSP,The White House has announced that the Soviet leader will visit the United States from the thirtieth May until June third
neutral,org,plain,announce,OTHERSP,The White House has announced that President Bush and Mikhail Gorbachev are to hold
neutral,org,plain,announce,OTHERSP,"The South African President, F W de Klerk announced he would meet President Bush later this month in the first visit"
neutral,pers,plain,announce,OTHERSP,"it should be announced yeah, I think that Kevin should take the job"
positive,pers,plain,announce,OTHERSP,"he was the victim of a burglary, he very proudly announced that he'd fitted one of these locks to his front door when we saw how he'd fitted it"
neutral,org,plain,announce,OTHERSP,then President Johnson announced he would not be standing for re-election
neutral,org,plain,announce,OTHERSP,"the defence secretary announced a number of measures, including the scrapping of a new nuclear missil"
neutral,pers,plain,announce,OTHERSP,I will ask the Secretary General to announce those. Ma'am the four elected by the life members of the order
neutral,org,plain,announce,OTHERSP,the chancellor will announce further defence cuts
neutral,org,plain,announce,OTHERSP, British Coal announced the pit was to go into the review procedure and revealed that it's lost more than six million
positive,pers,plain,announce,OTHERSP,The Lady proudly announced that the president of the Board of Trade had cut his large bath towels
neutral,org,plain,announce,OTHERSP,he new May Day Bank Holiday was announced in about nineteen seventy-two or three or something
neutral,org,plain,announce,OTHERSP,"the national figure has been announced that the, for the future year, and it does recognize the fact that"
neutral,pers,plain,announce,OTHERSP,Could you announce announce your Yes. Mike Michael Feist . . Sorry?
neutral,org,plain,announce,OTHERSP,Police have announced there's not enough evidence to bring criminal charges
