sentiment,objectivity,emotion,variant,type,sentence
positive,pers,violent,announce,FICTION,"You've had a visitor, by the way, he announced cheerfully. He didn't leave his name, but he said he'd call back"
neutral,pers,plain,announce,FICTION,"I apologise for my opinion, announced the loser formally."
negative,pers,plain,announce,FICTION,"The two ladies, breathless after their struggle with their German shepherd dog, announced themselves as the two Misses Bradshaw."
negative,pers,plain,announce,FICTION,"Three weeks earlier, her secretary had unexpectedly announced Mr Angus Maclayne on line three."
neutral,pers,plain,announce,FICTION,"After she had been applauded and gone out again, Mick announced that he would now demonstrate his Fred Astaire number."
neutral,pers,plain,announce,FICTION,Barak announced through the open driver's window.
neutral,pers,plain,announce,FICTION,"This afternoon, announces Molly, is the Over-Sixties Fancy Dress Competition."
neutral,pers,plain,announce,FICTION,"And who would be the next year's chairman otherwise asked Rose, guessing the answer announced Samuel, less happily than he might otherwise have done."
neutral,pers,plain,announce,FICTION,"We might as well say the Rosary now, he announced when he put pencil and paper away,"
neutral,pers,plain,announce,FICTION,"how come you follow him to Adelaide and, on the day before he's racing, you announce that you're pregnant? Ashley's mind seemed to implode."
negative,pers,plain,announce,FICTION,"This is all most irregular and we shall be consulting our legal advisers, Jeremiah Scrape announced. You've not heard the last of this, Swire Sugden threatened as he stormed out"
negative,pers,plain,announce,FICTION,I dough lak cartoo she announced. Carolyn stopped and stared at her.
neutral,pers,violent,announce,FICTION,"But this crime, and above all the manner in which it was mockingly announced, had a twisted sophistication, a kink in the logic"
neutral,pers,plain,announce,FICTION,The steward was about to announce them but Athelstan put a hand on his arm.
positive,pers,plain,announce,FICTION,"A jolt, and a voice booming through loudspeakers to announce our arrival in France. "
neutral,pers,plain,announce,FICTION,"that it's also her responsibility to keep the flat clean and tidy. The front room she	announced, opening a door, if one has the nerve to describe something quite this small as a front room."
negative,pers,plain,announce,FICTION,he can never make up his mind to marry or to start a serious career or to buy a house or to do anything else that may define and 	announce his character to the world even
neutral,pers,plain,announce,FICTION,He decided to while it away in the station cafeteria and was already on his third cup of coffee when the train's approach was announced over the Tannoy.
negative,pers,plain,announce,FICTION,"None was needed; the jewels signified dismissal,  announced the relationship was at an end."
neutral,pers,plain,announce,FICTION,"You arriving completely un announced in the middle of the night, using our house as a hotel."
neutral,pers,plain,announce,FICTION,"Faye said nothing more about it, but when they got home she announced that she would take her blood-sugar level and evening insulin dose"
positive,pers,plain,announce,FICTION,Everything! announced the old lady gleefully.
positive,pers,plain,announce,FICTION,"But imagine, if after we'd persuaded him to say all that, we announced that he'd decided to go back."
neutral,pers,plain,announce,FICTION,I'm going to have a bath Agnes announced. You'd better ring your hotel and leave this number there.
positive,pers,plain,announce,FICTION,Feeling battered in mind and body by the time Laura announced that she felt able to take a break and how about an early lunch?
positive,pers,plain,announce,FICTION,"I work here, he announced with dignity."
negative,pers,plain,announce,FICTION,he was jostled and shoved by passengers rushing for the boarding gates the moment their trains were announced over the Tannoy.
neutral,pers,plain,announce,FICTION,"I am taking you out, she	 announced. So 'urry now and change, please."
neutral,pers,plain,announce,FICTION,"She felt even sorrier for him with that stammer when he went up to read the first lesson, and had to announce that it came from the eighth chapter of Deuteronomy,"
positive,pers,plain,announce,FICTION,"About halfway across the Channel a man in a plastic mackintosh came back to a nearby table and announced that the rain had finally stopped just our luck,"
positive,pers,plain,announce,FICTION,"We are citizens of the British Empire and subjects of Her Majesty Queen Elizabeth the Second, she announced, as if to pre-empt any further questions,"
neutral,pers,plain,announce,FICTION,"The human has been back, he announced. It didn't get in, but it'll keep trying."
negative,pers,plain,announce,FICTION,"It was a shame to waste such a lovely day sitting indoors, he announced. Nothing would do but we must go out on the river."
neutral,pers,plain,announce,FICTION,"At the far end was a narrow door which, Thomas announced, led into the kitchen."
neutral,org,plain,announce,FICTION,It has also been said that if a member of a court	announced that he would give expression to his views by voting against every licence
neutral,pers,plain,announce,FICTION,"And how do you propose to announce your findings, Dexter?"
positive,pers,plain,announce,FICTION,"You are a beautiful lady, Arthur announced, removing his thumb for the purpose, and added as an afterthought"
neutral,pers,plain,announce,FICTION,"It was agreed that John Major, departing from precedent, should say a few words at nine-thirty, and announce that the national YC executive and officers were to be disbanded a la Tebbit."
neutral,pers,plain,announce,FICTION,At Christmas her Uncle Bertie assembled the clan at his manor house in Wiltshire and announced that as a start she had better be presented at Court.
neutral,pers,plain,announce,FICTION,"I have a touch of the Quechua in me. He announced this in English, an explanation of something he had said that Ward had not understood."
positive,pers,plain,announce,FICTION,"she eased it open and stepped through the doorway, sending up a silent prayer that no creaking floorboard would announce her presence prematurely."
neutral,pers,plain,announce,FICTION,Francis appeared to annoucne that they were going down into Bourg to fetch some wine.
neutral,org,plain,announce,FICTION,plains where the short rains are expected. They are announced by atmospheric restlessness: papers in the street below suddenly dance
neutral,pers,plain,announce,FICTION,You've seen it in the corner of the office. The police announced it this morning.
neutral,pers,plain,announce,FICTION,"You will all be segregated for the duration of the operation, Legion announced to the assembled Project Eden team."
negative,pers,plain,announce,FICTION,"I've got a dead white face, staring black eyes, stringy hair and I need a shave, she announced in a rush, put the phone down and collapsed into gales of laughter."
neutral,pers,plain,announce,FICTION,"I'm dog-tired after that trek this afternoon, he announced with a brief compassionate glance at Sarella."
positive,pers,violent,announce,FICTION,"Nevertheless, he expected assistance from him. Mutton broth announced Sir Thomas proudly,"
positive,pers,plain,announce,FICTION,"When all the Packs had circled the field twice, the judges announced the winners through the loud-speaker."
neutral,pers,plain,announce,FICTION,"She needs coffee, I announce. Make the girl some coffee."
neutral,pers,plain,announce,FICTION,After no more than five minutes Bunny announced they could begin.
neutral,pers,plain,announce,FICTION,So what was he going to do about Leila? If anything. Zeinab announced that she was taking Owen to the theatre.
neutral,pers,plain,announce,FICTION,"a spoon and a fork before giving her one of the bowls. he announced, then sat down with his own."
neutral,pers,plain,announce,FICTION,"It was about four o’clock, he announced. Chap called Peter something."
neutral,org,plain,announce,FICTION,But then a cloud of dust on the horizon announced the arrival of their enemies.
negative,pers,plain,announce,FICTION,"I'll betray my friends for a Winston) when Stuart, with a creepily smug look on his face, suddenly announces, We're taking off, you know."
neutral,pers,plain,announce,FICTION,"then, rather than admit the error, the Board had to announce further that it would be open for the reception of plans"
neutral,org,plain,announce,FICTION,"In favour of the motion to increase the subsidy on Uridian marioc by sixteen per cent, 522 votes,	announce d Neputa Tharm, Leader of the Council of the Galaxy."
neutral,org,plain,announce,FICTION,"After a private conference with Mother Superior, the Sisters announced that there would be a special rosary every morning,"
neutral,pers,plain,announce,FICTION,"And take your partners for a tango, Sid	announced. Elinor and Nigel were soon into their stride"
neutral,pers,plain,announce,FICTION,"But for the moustache, their faces were identical. They bowed. Saskia and Mogul Zodiac, they announce	d, in unison. The Twinssaid Marco"
neutral,pers,plain,announce,FICTION,"Dame Frances sat down on a stool, her face in her hands. What that dour clerk had announced must be connected with the death of Lady Eleanor"
neutral,pers,plain,announce,FICTION,"his brother across a bare table in the visiting room, which was otherwise deserted. Word's got round, he	announced. I can do virtually whatever I like here now"
neutral,pers,plain,announce,FICTION,"Mother answered, then she came into the sitting-room and announced, Clare's coming home"
neutral,pers,plain,announce,FICTION,He opened the door and waved Duncan in Captain Duncan Carson announced Duncan to the man in the room
negative,pers,plain,announce,FICTION,It was when they were in the process of doing just that that Edward Greenwood walked in un announced. Helen shook her head in denial as she met Sophie's accusing glance
positive,pers,plain,announce,FICTION,"A bit of heat, they allowed, was all right, but this was no joke, it wasn't. Be a storm afore long, announced one old man;;I can feel it in me knees"
neutral,pers,plain,announce,FICTION,Obviously a married woman can't just get up from her chair at that time of the evening and announce that she's going out.
positive,pers,plain,announce,FICTION,"God! What grand ideas did he have for that? Now here, he announced brutally, is the perfect place for one of those Japanese-style bridges"
neutral,pers,plain,announce,FICTION,"picked up his hairbrush to untangle the knots from her hair. It isn't the sort of thing one announces, is it? You knowHello, I'm Fran Williams and I'm a virgin"
neutral,pers,plain,announce,FICTION,"He watched as Edna wheeled the pram back to the house, having announced that it was time for a certain person's tea"
neutral,pers,plain,announce,FICTION,"In the brief pause before the auctioneer announced the next lot, Emily spotted her father near the back of the gathering"
neutral,pers,plain,announce,FICTION,"when St Ives burst into the room without knocking. I shall go crazy, he announced. He wore a hair-net and was brandishing on his fist his Caesar wig with the laurel wreath"
neutral,org,plain,announce,FICTION,He remembered this because it was the day on which the BBC Home Service had announced the news that Her Majesty the Queen had given birth
neutral,pers,plain,announce,FICTION,"waistcoat was striped in black and subdued gold. here has been a call, monsieur, he announced, taking the luggage and casting one interested look"
neutral,pers,plain,announce,FICTION," But the danger passed, and by the next night Dr Losberne was able to announce that, though seriously ill, Rose would not die"
neutral,pers,plain,announce,FICTION,"One day, while he and I were walking on the moors, he announced, Jane, I'll be leaving in six weeks"
negative,pers,plain,announce,FICTION,Is it too late to go back? Will we feel silly if we go back up and announce to no one in particular
neutral,pers,plain,announce,FICTION,"He hurried into the back room. Charlotte heard him dial, then, a moment later, announce himself. C'est moi. Oui."
neutral,pers,plain,announce,FICTION,When her mother died Constance had turned slightly vegetarian and announced that she would never have any children
neutral,pers,plain,announce,FICTION,On a London bus she had heard a driver announce Stoke-Jewington when driving through Islington
neutral,pers,plain,announce,FICTION,abjure the Devil and seek proper medical attention. Their placards announced them as Catholic Youth Against Witchcraft.
neutral,pers,plain,announce,FICTION,"fit the particular embarrassments of the lived life. At seventeen, he announces that he wants to spend his whole life in a ruined castle by the sea"
neutral,pers,plain,announce,FICTION,"The Beatles had their first Number One wearing a pink trouser suit with waistcoat, announced herself as the hospital administrator and told us to follow her"
neutral,pers,plain,announce,FICTION,"This is our little guest cottage, she announced as they mounted some steps on to a wide, spacious veranda"
neutral,pers,plain,announce,FICTION,"She heard her mother's voice on the day when she had announced her engagement: Well, you're thirty-two and if he's what you want"
neutral,pers,plain,declare,FICTION,"Giles began to laugh too: Oh Christ, sorry, Liz, sorry, Kate, he declared, as he organized himself into a sitting position"
positive,pers,violent,declare,FICTION,"That was a fabulous meal, she declared enthusiastically after the pudding plates had been cleared away"
positive,pers,violent,declare,FICTION,"although I doubt if you'll find him there. I'm staying with Merv, Chrissie declared, clinging firmly to his hand."
neutral,pers,plain,declare,FICTION,Amaranth was the subject of much comment. One matron declared that if Ms Wilikins-the accent was on the Ms
negative,pers,violent,declare,FICTION,"You are being foolish beyond permission! he declared angrily, his hands dragging her to him so that his feverish glare burned into her eyes"
negative,pers,violent,declare,FICTION,"Not if I get to her first, you won't Laura declared, so viciously that Ross hoped his ex-personal assistant had the good sense"
neutral,pers,violent,declare,FICTION,"her elaborately draped velvet toque but eminently sensible. This is the train, she declared. Come along, Dorothy, or we shan't get a seat."
negative,pers,plain,declare,FICTION,"People with her attitude burnt my grandmother's home to the ground in Maggie declared. They brought her out with a gun in her back,"
negative,pers,plain,declare,FICTION,She hesitated on the edge of speech. Should she ask herself in; declare herself and deliver her warning in person?
negative,pers,violent,declare,FICTION,"Because space is nothing,and you can't curve nothing she declared triumphantly."
neutral,org,plain,declare,FICTION,"A Dutch businessman had proposed the idea, a wonderful invention  A tin of caviar but the label declared the produce to be herring"
negative,org,plain,declare,FICTION,"The senator responded with a practised smile. What Presidential prospects? I haven’t declared. Rickie's still an embarrassment, I accused him"
negative,org,plain,declare,FICTION,"Ken Mentle, who often made up club rules as he went along, declared that his was the casting vote and promptly blocked the appointment, incredibly"
negative,pers,violent,declare,FICTION,But I for one am never going to let anyone walk over me. Me neither! Jimmy declared. Mr Sanderson shook his head. Rearmament is a mistake
negative,pers,violent,declare,FICTION,"It was almost as if , after years of stolidly predictable behaviour, an old and respected great-uncle had declared himself to be a Buddhist or a Muslim or the follower of some obscure Eastern mystic"
neutral,org,plain,declare,FICTION,Already the world may know my story. Anyone who has heard it will declare that this is but of a piece with all the rest!
negative,pers,violent,declare,FICTION,"I'm afraid the pilot didn't make it. His neck's broken, he declared tersely. She stared at him, aghast, and tears of remorse welled up"
negative,org,plain,declare,FICTION,"Four months after Will's death, two things happened that helped Constance forget the past. War was declared and, more or less at the same time, her mother, who wished to distance her from the rough"
neutral,pers,violent,declare,FICTION,"he questioned. I'm twenty-two! Fabia declared, stoutly, it somehow not sitting very well at all that he seemed to think of her as a child"
negative,pers,violent,declare,FICTION,"You'd better pray we reach it soon, he	declare	d, and stalked away. Speechless, and more than a little shaken"
negative,org,plain,declare,FICTION,"You're talking to me! Mandy crowed. It's because we're about to	 declare	 a state of emergency, Charity responded drily"
positive,pers,violent,declare,FICTION,"Dora jerked her head like a horse shying at a pheasant. Well, I have every reason to think so! she declared. I see it now it's that stupid young fool's idea of a joke"
neutral,pers,plain,declare,FICTION,"Yes. It was the only thing he found interesting during the evening, I think. ’The man is a Philistine,	 declared Gamal. What was he doing there, anyway?"
negative,pers,violent,declare,FICTION,Then towards the end she had lost her temper completely and declared that if the listeners wanted to find out what it was really all about
neutral,org,plain,declare,FICTION,"amplified announcements in the nine principal languages of the otherworld page the missing, declare the starting times of special events, invite attendance at lectures"
positive,pers,violent,declare,FICTION,I feel great. Malik declared the cricket season three months early
negative,pers,violent,declare,FICTION,"Mrs Browning had declared it was all too bad, too dreadful an imposition to have been responsible for and that she would not be able to look the Ogilvys"
negative,pers,plain,declare,FICTION,"Raucous with disappointment, going in you counted down the decades to declare you will be eighty-seven next time round"
negative,pers,plain,declare,FICTION,"Irina was wearing a blue-and-brown check low-waisted summer dress with pleats, which Alison had already declared to Franca to be too smart, too old, and too expensive"
positive,pers,violent,declare,FICTION,"Isabella, Mr Edgar's sister, a pretty girl of eighteen, suddenly declared that she was in love with Heathcliff"
negative,pers,violent,declare,FICTION,Mould looked down in disbelief and was about to declare his disgust at their catch when the rope snapped
negative,pers,plain,declare,FICTION,"""No one blames Andrew for marrying again?"" ""No, no. An inquest declared Horatia dead"
negative,pers,plain,declare,FICTION,"A gardener was found drowned in the lake. Suicides, or so the coroner declared. Rachel's sombre words chilled all our souls"
positive,pers,plain,declare,FICTION,"They were lucky, Mrs Carson declared, to have received such an invitation."
neutral,pers,plain,declare,FICTION,My dad gave him the sort of look that only someone declared clinically dead can manage
neutral,org,plain,declare,FICTION,"When war was first declared, and she was co-opted into the military"
neutral,pers,violent,declare,FICTION,"He would not have gone! Rose declared. In any event, he was near fifteen by then"
negative,pers,plain,declare,FICTION,"he asked cosily, lifting the corner of one. Cold meat, he declared, sounding disappointed."
neutral,pers,violent,declare,FICTION,One or two people announced that they didn't either; others declared loudly that they did.
neutral,pers,plain,declare,FICTION,In the late sixties he had declared Couture is dead!
neutral,pers,plain,declare,FICTION,"You'll do no such thing, declared Naylor. You'd no idea I'd be bringing Leith home when you made your arrangements"
positive,pers,plain,declare,FICTION,"He also had more than a crush, Vitor declared. Ashley, the kid was always so damn pleased when you were around"
positive,pers,violent,declare,FICTION,"I am training her so that she can cook for royalty, Auguste declared grandly. And the young cock of the walk"
neutral,pers,plain,declare,FICTION,"What's more, I intend to say it properly, he declared, reducing speed to turn into a parking area that lay a few yards ahead"
neutral,pers,plain,declare,FICTION,"iYou're saying we should forget it?he enquired. I already have, Ashley declared and, climbing from the vehicle, she swung jauntily into the hotel without looking behind her"
neutral,org,plain,declare,FICTION,"Of a sudden Joe was thankful that a war had been declared: Martin would join up and, because of his principles, he wouldn't then marry Miss Crosbie"
neutral,pers,violent,declare,FICTION,"I think this will help you, the young library assistant declared, in heavily accented English, as she set the large atlas down on a nearby table"
negative,pers,plain,declare,FICTION,"Far from being grateful, she complained of the smell within and declared that sleeping in the open air had its merits."
negative,pers,plain,declare,FICTION,"I shall flatly refuse to take him with me on my rounds, he declared. There! It was out. And he felt all the better for it"
negative,org,plain,declare,FICTION,the pressure of letters continued to build up urging the Society to declare more fully its membership criteria. 
neutral,pers,violent,declare,FICTION,"she almost shouted. Doreen's chin rose as she declared with confidence, Of course I'll be with Silas"
positive,pers,plain,declare,FICTION,"as if it was her real plumage, and she’d declare: My dears, I am preparing for The Flight into Egypt, to the islands, to the New World"
positive,pers,plain,declare,FICTION,"Had she hoped that Simon would alert Vitor to her presence, and that he might search her out, explain he had rethought and declare undying love? Her lips formed a bleak smile"
neutral,pers,plain,declare,FICTION,"Antoinette surveyed her niece. onie is looking quite well, she declared: but her hair has not been properly brushed"
neutral,org,plain,declare,FICTION,"In the effervescence of his accession as His Lordship thirty years earlier, Fulgor Sagramoso had declared himself to be an independent sovereign ruler and a God"
negative,pers,violent,declare,FICTION,"In her outlandish, simple dialect she had declared, Me, Lindi! Me, Lindi Soon the seven-year-old girl had killed an older pupil who mocked her"
negative,pers,violent,declare,FICTION,"Mould looked down in disbelief and was about to declare his disgust at their catch when the rope snapped, returning the lump of metal to the sea"
neutral,pers,violent,declare,FICTION,"No one 's taking the poor girl anywhere, declared Dolly firmly as she emerged from the room to confront Boz"
neutral,org,plain,announce,NEWS,The Scottish figures which were	announced in outline last December were mapped out
neutral,org,plain,announce,NEWS,Three ministers	announced that they were leaving the Government at their own request
neutral,org,plain,announce,NEWS,Chancellor Norman Lamont is expected to announce a solution to the VAT problem that threaten's the industry's future in Britain
neutral,org,plain,announce,NEWS,Friction between Mr Junejo and the president grew and in May 1988 Gen Zia announced the dismissal of Mr Junejo and the National Assembly
neutral,org,plain,announce,NEWS,"On the day his result was announced, he was released after five years of detention without trial"
neutral,org,plain,announce,NEWS,The arrangements announced yesterday to ease the introduction of the poll tax are symptomatic of a less rigorous approach
positive,org,plain,announce,NEWS,"experience the thrill of bungee jumping, and yesterday he was announced as the county winner in a national competition for young entrepreneurs"
positive,pers,plain,announce,NEWS,"I hope to announce exciting new plans soon, said Broccoli"
neutral,org,plain,announce,NEWS,"be axed at Unilever Research's Port Sunlight laboratory, the company announced today. The cuts are part of a major shake-up at the laboratory which employs 1,300 staff"
negative,org,plain,announce,NEWS,The previously-	announced 1 billion cost of rationalising BAe's heavily-loss-making regional aircraft division
neutral,org,plain,announce,NEWS,all senior ANC members of the eight men whose release Mr de Klerk was to announce that night. Further suggesting to Mrs Sisulu that she might afford to hope
neutral,org,plain,announce,NEWS,low of 19p to 23p yesterday after it announce d much reduced trading losses
neutral,org,plain,announce,NEWS,"Channel 4 Relief greeted the Government decision, announced in the spring, that Channel 4 had escaped privatisation after a battle fought"
neutral,pers,plain,announce,NEWS,The clean-cut TV and radio presenter announced he was delighted &#8212; but not half as happy as his mother
neutral,org,plain,announce,NEWS,"Winners, here and elsewhere, will be announced next Friday."
neutral,org,plain,announce,NEWS,"they will be able to sell their shares after the allocation is	 announced on Monday, before letters of allocation arrive"
neutral,org,plain,announce,NEWS,monitor the integrity and accuracy of government statistics gained momentum yesterday when plans were announced for a meeting to draw up firm proposals
neutral,pers,plain,announce,NEWS,Offiah was due to leave Heathrow Airport at 6.30pm last night but the airline announced at 10.30pm that the flight would be postponed until this morning
neutral,org,plain,announce,NEWS,"THE Queen will not pay tax despite public demands, Chancellor Norman Lamont announced last night"
negative,org,plain,announce,NEWS,"On 8 June, four days after the Tiananmen massacre and the day after rioting in Hong Kong, Chinese negotiators announced they were ready They were pressing us like hell to sign"
